{
  "schema_version": "1.0.0",
  "astrazit_release_id": "AST-REL-000002",
  "title": "Fictional Chronicles of Astra",
  "artist": "AstraZit",
  "release_type": "ALBUM",
  "catalog_origin": "NATIVE",
  "lifecycle_status": "RELEASED",
  "release_date": "2026-08-15",
  "upc": "123456789099",
  "tracklist": [
    {
      "track_number": 1,
      "disc_number": 1,
      "astrazit_recording_id": "AST-REC-000001"
    },
    {
      "track_number": 2,
      "disc_number": 1,
      "astrazit_recording_id": "AST-REC-000002"
    }
  ],
  "artwork": [
    {
      "asset_id": "art-rel-000002",
      "asset_type": "COVER_ART",
      "uri": "gs://astrazit-catalog-artwork/AST-REL-000002/chronicles_cover.png",
      "mime_type": "image/png"
    }
  ],
  "distribution": [
    {
      "provider": "distrokid",
      "external_release_id": "DK-ALB-000002",
      "status": "LIVE",
      "urls": {
        "spotify": "https://open.spotify.com/album/fictionalChronicles002"
      }
    }
  ],
  "provenance": {
    "source": "HUMAN_ENTERED",
    "source_system": "release_gate_coordinator",
    "generated_at": "2026-08-15T00:00:00Z",
    "approval_status": "APPROVED",
    "approver": "fictional-label-executive",
    "approved_at": "2026-08-15T00:00:00Z",
    "version": 1,
    "canonical_status": "MASTER_METADATA",
    "notes": " Fictional fixture only: no real ownership, approvals, catalog allocations, or assets are asserted."
  }
}
